Order,Block,Goal,Heading,Volume,KeyPhrases,Content
1,Hero,"Подтвердить услугу, город и коммерческий интент",Ремонт акумулятора електросамоката у Харкові,100-140 слов,ремонт акумулятора електросамоката харків; ремонт аккумулятора электросамоката харьков,"Цена от, диагностика, BMS, быстрый разряд, адрес, CTA"
2,Симптомы,Пользователь узнает свою проблему,Коли потрібен ремонт акумулятора,150-200 слов,акумулятор електросамоката не тримає заряд; электросамокат быстро разряжается,"Быстро садится, не заряжается, выключается, малая дальность, после зимы"
3,Причины,Показать экспертность,Чому батарея втрачає ємність,180-240 слов,ремонт батареї електросамоката харків; ремонт батареи электросамоката харьков,"Износ элементов, BMS, дисбаланс, глубокий разряд, вода, неправильная зарядка"
4,Диагностика,Снять страх случайной замены,Що перевіряє майстер,140-190 слов,діагностика акумулятора електросамоката,"Напряжение, баланс, BMS, контакты, нагрузка, зарядный порт"
5,Ремонт или замена,Объяснить варианты,"Ремонт, перепаковка чи заміна акумулятора",160-220 слов,перепаковка акумулятора електросамоката; заміна акумулятора електросамоката харків,"Когда восстановление возможно, когда нужна замена, почему цена после проверки"
6,Цены,Дать коммерческий ориентир,Ціни на ремонт акумулятора,таблица + 90 слов,ремонт bms електросамоката; замена аккумулятора электросамоката харьков,"Диагностика от 100, BMS после проверки, элементы после диагностики"
7,Бренды,Закрыть брендовые хвосты,Які бренди приймаємо,90-130 слов,xiaomi m365 акумулятор ремонт; ninebot батарея; kugoo аккумулятор,"Xiaomi, Ninebot, Kugoo, Crosser, Giant, Proove, Koko City"
8,Что делать,Полезность и безопасность,Що робити до звернення,90-130 слов,глибокий розряд акумулятора електросамоката,"Не вскрывать АКБ, не заряжать при запахе/нагреве, взять зарядку"
9,Процесс,Показать порядок,Як проходить ремонт,100-140 слов,сервіс електросамокатів харків,"Заявка, диагностика, согласование, ремонт, тест"
10,FAQ,Закрыть хвосты,FAQ,6 вопросов,почему электросамокат быстро разряжается; сколько стоит батарея,"Стоимость, сроки, BMS, перепаковка, бренды, гарантия"
